{
  "$schema": "https://json-schema.org/draft/2020-12/schema",
  "$id": "https://github.com/vyncint/reconverge/blob/main/schemas/witness.v1.json",
  "title": "witness.v1",
  "description": "Witness artifact: a concrete replay of one finding under one launch configuration -- the declared block when a #[launch_contract] names one of whole warps up to 128 threads (any shape: lane n is the thread at linear index n, x fastest), and one warp when it names none. A declared block of any other size is not replayed, and is never replayed as some other shape. Lane states are delta-encoded per step (only changes are recorded), so a 10k-step trace stays small. Additive-only within v1; consumers must tolerate unknown fields. reconverge-artifacts::witness is the Rust binding; fixtures/witness/ are the API tests.",
  "type": "object",
  "required": ["schema", "tool", "crate", "kernel", "launch", "lanes", "initial_lane_states", "steps", "verdict"],
  "properties": {
    "schema": { "const": "witness.v1" },
    "tool": {
      "type": "object",
      "required": ["name", "version"],
      "properties": {
        "name": { "type": "string" },
        "version": { "type": "string" }
      }
    },
    "crate": { "type": "string" },
    "kernel": { "type": "string", "description": "User-facing kernel name." },
    "finding": {
      "type": "object",
      "description": "The finding this witness replays.",
      "required": ["code"],
      "properties": {
        "code": { "type": "string", "pattern": "^RC[0-9]{3}$" },
        "span": { "$ref": "#/$defs/span" }
      }
    },
    "launch": {
      "type": "object",
      "description": "Concrete thread configuration the search found.",
      "required": ["grid", "block"],
      "properties": {
        "grid": { "$ref": "#/$defs/dim3" },
        "block": { "$ref": "#/$defs/dim3" },
        "warp": { "type": "integer", "minimum": 0, "description": "Index of the replayed warp within its block." }
      }
    },
    "lanes": { "type": "integer", "minimum": 32, "maximum": 128, "multipleOf": 32, "description": "The replayed block's thread count: 32 for an undeclared kernel's one-warp replay, or the declared block's x*y*z. This was `const: 32` through 0.4.0 while the driver had been writing 64, 96 and 128 since 0.1.12 -- so the artifacts that failed validation were exactly the gating ones." },
    "initial_lane_states": {
      "type": "array",
      "description": "One entry per lane: `lanes` long.",
      "minItems": 32,
      "items": { "$ref": "#/$defs/lane_state" }
    },
    "steps": {
      "type": "array",
      "items": {
        "type": "object",
        "required": ["index", "statement", "lane_changes"],
        "properties": {
          "index": { "type": "integer", "minimum": 0 },
          "statement": { "type": "string", "description": "What happens at this step, in prose: \"sync_threads() - 16 of 32 lanes arrive and wait\". Documented as a MIR statement through 0.4.0, which no released driver has ever emitted: the replay is built from the site rather than by walking statements, and the model drops the printable form at extraction. If the MIR line is ever carried through, it belongs in a second field beside this one." },
          "span": { "$ref": "#/$defs/span" },
          "lane_changes": {
            "type": "array",
            "description": "Delta encoding: only lanes whose state changed at this step. Invariant: at any step carrying a `warp_op`, the lanes still present after replaying the deltas up to and including that step are exactly the set bits of `warp_op.active` -- so the lane strip a debugger draws agrees with the mask row beneath it.",
            "items": {
              "type": "object",
              "required": ["lane", "state"],
              "properties": {
                "lane": { "type": "integer", "minimum": 0, "maximum": 127 },
                "state": { "$ref": "#/$defs/lane_state" }
              }
            }
          },
          "barrier": {
            "type": "object",
            "description": "Present when this step is a barrier interaction.",
            "required": ["arrived", "expected"],
            "properties": {
              "arrived": { "type": "integer", "minimum": 0 },
              "expected": { "type": "integer", "minimum": 1 }
            }
          },
          "warp_op": {
            "type": "object",
            "description": "Present when this step is a warp collective.",
            "required": ["op", "mask", "active"],
            "properties": {
              "op": { "type": "string", "description": "e.g. shfl_sync, ballot_sync" },
              "mask": { "type": "string", "pattern": "^0x[0-9a-f]{8}$", "description": "Participation mask named by the call." },
              "active": { "type": "string", "pattern": "^0x[0-9a-f]{8}$", "description": "Lanes actually active at the call site." }
            }
          }
        }
      }
    },
    "verdict": {
      "type": "object",
      "required": ["kind", "message"],
      "properties": {
        "kind": { "enum": ["hang", "undefined-behavior", "completed", "no-witness"] },
        "message": { "type": "string", "description": "Calibrated wording; hardware behavior is 'usually', never 'always'." },
        "step": { "type": "integer", "minimum": 0, "description": "Step index where the verdict was reached." }
      }
    }
  },
  "$defs": {
    "lane_state": { "enum": ["active", "waiting", "exited"] },
    "dim3": {
      "type": "array",
      "minItems": 3,
      "maxItems": 3,
      "items": { "type": "integer", "minimum": 1 }
    },
    "span": {
      "type": "object",
      "description": "1-based lines and columns, end-inclusive.",
      "required": ["file", "line_start", "column_start", "line_end", "column_end"],
      "properties": {
        "file": { "type": "string" },
        "line_start": { "type": "integer", "minimum": 1 },
        "column_start": { "type": "integer", "minimum": 1 },
        "line_end": { "type": "integer", "minimum": 1 },
        "column_end": { "type": "integer", "minimum": 1 }
      }
    }
  }
}
