{
  "schema": "witness.v1",
  "tool": {
    "name": "reconverge",
    "version": "0.7.0"
  },
  "crate": "lint_samples",
  "kernel": "rc001_divergent_barrier",
  "finding": {
    "code": "RC001",
    "span": {
      "file": "src/lib.rs",
      "line_start": 184,
      "column_start": 9,
      "line_end": 184,
      "column_end": 31
    }
  },
  "launch": {
    "grid": [
      1,
      1,
      1
    ],
    "block": [
      32,
      1,
      1
    ],
    "warp": 0
  },
  "lanes": 32,
  "initial_lane_states": [
    "active",
    "active",
    "active",
    "active",
    "active",
    "active",
    "active",
    "active",
    "active",
    "active",
    "active",
    "active",
    "active",
    "active",
    "active",
    "active",
    "active",
    "active",
    "active",
    "active",
    "active",
    "active",
    "active",
    "active",
    "active",
    "active",
    "active",
    "active",
    "active",
    "active",
    "active",
    "active"
  ],
  "steps": [
    {
      "index": 0,
      "statement": "lanes evaluate the guarding branch — 16 continue toward `sync_threads`, 16 never will",
      "span": {
        "file": "src/lib.rs",
        "line_start": 183,
        "column_start": 8,
        "line_end": 183,
        "column_end": 24
      },
      "lane_changes": []
    },
    {
      "index": 1,
      "statement": "sync_threads() — 16 of 32 lanes arrive and wait",
      "span": {
        "file": "src/lib.rs",
        "line_start": 184,
        "column_start": 9,
        "line_end": 184,
        "column_end": 31
      },
      "lane_changes": [
        {
          "lane": 0,
          "state": "waiting"
        },
        {
          "lane": 2,
          "state": "waiting"
        },
        {
          "lane": 4,
          "state": "waiting"
        },
        {
          "lane": 6,
          "state": "waiting"
        },
        {
          "lane": 8,
          "state": "waiting"
        },
        {
          "lane": 10,
          "state": "waiting"
        },
        {
          "lane": 12,
          "state": "waiting"
        },
        {
          "lane": 14,
          "state": "waiting"
        },
        {
          "lane": 16,
          "state": "waiting"
        },
        {
          "lane": 18,
          "state": "waiting"
        },
        {
          "lane": 20,
          "state": "waiting"
        },
        {
          "lane": 22,
          "state": "waiting"
        },
        {
          "lane": 24,
          "state": "waiting"
        },
        {
          "lane": 26,
          "state": "waiting"
        },
        {
          "lane": 28,
          "state": "waiting"
        },
        {
          "lane": 30,
          "state": "waiting"
        }
      ],
      "barrier": {
        "arrived": 16,
        "expected": 32
      }
    },
    {
      "index": 2,
      "statement": "the other 16 lanes exit or move past reconvergence without ever reaching the barrier",
      "span": {
        "file": "src/lib.rs",
        "line_start": 183,
        "column_start": 8,
        "line_end": 183,
        "column_end": 24
      },
      "lane_changes": [
        {
          "lane": 1,
          "state": "exited"
        },
        {
          "lane": 3,
          "state": "exited"
        },
        {
          "lane": 5,
          "state": "exited"
        },
        {
          "lane": 7,
          "state": "exited"
        },
        {
          "lane": 9,
          "state": "exited"
        },
        {
          "lane": 11,
          "state": "exited"
        },
        {
          "lane": 13,
          "state": "exited"
        },
        {
          "lane": 15,
          "state": "exited"
        },
        {
          "lane": 17,
          "state": "exited"
        },
        {
          "lane": 19,
          "state": "exited"
        },
        {
          "lane": 21,
          "state": "exited"
        },
        {
          "lane": 23,
          "state": "exited"
        },
        {
          "lane": 25,
          "state": "exited"
        },
        {
          "lane": 27,
          "state": "exited"
        },
        {
          "lane": 29,
          "state": "exited"
        },
        {
          "lane": 31,
          "state": "exited"
        }
      ]
    }
  ],
  "verdict": {
    "kind": "undefined-behavior",
    "message": "16 of 32 lanes wait at `sync_threads()` while 16 never arrive; the barrier cannot be satisfied — undefined behavior on hardware, usually a permanent hang",
    "step": 2
  }
}
