{
  "schema": "witness.v1",
  "tool": {
    "name": "reconverge",
    "version": "0.8.0"
  },
  "crate": "lint_samples",
  "kernel": "rc002_divergent_collective",
  "finding": {
    "code": "RC002",
    "span": {
      "file": "src/lib.rs",
      "line_start": 371,
      "column_start": 16,
      "line_end": 371,
      "column_end": 52
    }
  },
  "launch": {
    "grid": [
      1,
      1,
      1
    ],
    "block": [
      32,
      1,
      1
    ],
    "warp": 0
  },
  "lanes": 32,
  "initial_lane_states": [
    "active",
    "active",
    "active",
    "active",
    "active",
    "active",
    "active",
    "active",
    "active",
    "active",
    "active",
    "active",
    "active",
    "active",
    "active",
    "active",
    "active",
    "active",
    "active",
    "active",
    "active",
    "active",
    "active",
    "active",
    "active",
    "active",
    "active",
    "active",
    "active",
    "active",
    "active",
    "active"
  ],
  "steps": [
    {
      "index": 0,
      "statement": "lanes evaluate the guarding branch — 16 continue toward `ballot_sync`, 16 never will",
      "span": {
        "file": "src/lib.rs",
        "line_start": 370,
        "column_start": 8,
        "line_end": 370,
        "column_end": 24
      },
      "lane_changes": []
    },
    {
      "index": 1,
      "statement": "ballot_sync() — active lanes 0x55555555, mask 0xffffffff",
      "span": {
        "file": "src/lib.rs",
        "line_start": 371,
        "column_start": 16,
        "line_end": 371,
        "column_end": 52
      },
      "lane_changes": [
        {
          "lane": 1,
          "state": "exited"
        },
        {
          "lane": 3,
          "state": "exited"
        },
        {
          "lane": 5,
          "state": "exited"
        },
        {
          "lane": 7,
          "state": "exited"
        },
        {
          "lane": 9,
          "state": "exited"
        },
        {
          "lane": 11,
          "state": "exited"
        },
        {
          "lane": 13,
          "state": "exited"
        },
        {
          "lane": 15,
          "state": "exited"
        },
        {
          "lane": 17,
          "state": "exited"
        },
        {
          "lane": 19,
          "state": "exited"
        },
        {
          "lane": 21,
          "state": "exited"
        },
        {
          "lane": 23,
          "state": "exited"
        },
        {
          "lane": 25,
          "state": "exited"
        },
        {
          "lane": 27,
          "state": "exited"
        },
        {
          "lane": 29,
          "state": "exited"
        },
        {
          "lane": 31,
          "state": "exited"
        }
      ],
      "warp_op": {
        "op": "ballot_sync",
        "mask": "0xffffffff",
        "active": "0x55555555"
      }
    },
    {
      "index": 2,
      "statement": "16 lanes named by the mask never reach the call",
      "span": {
        "file": "src/lib.rs",
        "line_start": 370,
        "column_start": 8,
        "line_end": 370,
        "column_end": 24
      },
      "lane_changes": []
    }
  ],
  "verdict": {
    "kind": "undefined-behavior",
    "message": "`ballot_sync()` executes with active lanes 0x55555555 but its mask 0xffffffff names 16 lanes that never arrive — undefined behavior on hardware, usually a kernel that never finishes",
    "step": 2
  }
}
